[
  {
    "_comment": "=== RESERVED & FALLBACK MATERIALS (ID 0-9) === (was numeric ID 1)",
    "id": "core_mat_air",
    "aliases": [
      "air"
    ],
    "tags": [
      "gas",
      "empty"
    ],
    "density_solid": 1,
    "work": {
      "forgeable": false,
      "weldable": false,
      "carveable": false,
      "processDifficultyMulFx": 10000
    },
    "mechanics": {
      "hardnessEdgeFx": 0,
      "toughnessFracFx": 0,
      "rigidityFx": 0
    },
    "electricMagic": {
      "manaConductivityFx": 10000,
      "electricCategory": "insulator"
    },
    "economy": {
      "valueMulFx": 0,
      "beautyMulFx": 0
    }
  },
  {
    "id": "core_mat_stone_generic",
    "aliases": [
      "stone_generic",
      "generic_stone"
    ],
    "tags": [
      "stone",
      "generic",
      "fallback"
    ],
    "density_solid": 2500,
    "work": {
      "forgeable": false,
      "weldable": false,
      "carveable": true,
      "processDifficultyMulFx": 12000
    },
    "mechanics": {
      "hardnessEdgeFx": 6500,
      "toughnessFracFx": 6000,
      "rigidityFx": 8500
    },
    "electricMagic": {
      "manaConductivityFx": 3000,
      "electricCategory": "insulator"
    },
    "economy": {
      "valueMulFx": 10000,
      "beautyMulFx": 5000
    }
  },
  {
    "id": "core_mat_mineral_generic",
    "aliases": [
      "mineral_generic",
      "generic_mineral"
    ],
    "tags": [
      "mineral",
      "generic",
      "fallback"
    ],
    "density_solid": 2000,
    "work": {
      "forgeable": false,
      "weldable": false,
      "carveable": false,
      "processDifficultyMulFx": 10000
    },
    "mechanics": {
      "hardnessEdgeFx": 4000,
      "toughnessFracFx": 3000,
      "rigidityFx": 6000
    },
    "electricMagic": {
      "manaConductivityFx": 5000,
      "electricCategory": "insulator"
    },
    "economy": {
      "valueMulFx": 5000,
      "beautyMulFx": 3000
    }
  },
  {
    "id": "core_mat_metal_generic",
    "aliases": [
      "metal_generic",
      "generic_metal",
      "scrap_metal"
    ],
    "tags": [
      "metal",
      "generic",
      "fallback",
      "scrap"
    ],
    "density_solid": 7000,
    "work": {
      "forgeable": true,
      "weldable": true,
      "carveable": false,
      "processDifficultyMulFx": 10000
    },
    "mechanics": {
      "hardnessEdgeFx": 4500,
      "toughnessFracFx": 7000,
      "rigidityFx": 8000
    },
    "electricMagic": {
      "manaConductivityFx": 3000,
      "electricCategory": "conductor"
    },
    "economy": {
      "valueMulFx": 5000,
      "beautyMulFx": 2000
    }
  },
  {
    "id": "core_mat_organic_generic",
    "aliases": [
      "organic_generic",
      "generic_organic"
    ],
    "tags": [
      "organic",
      "generic",
      "fallback"
    ],
    "density_solid": 800,
    "work": {
      "forgeable": false,
      "weldable": false,
      "carveable": true,
      "processDifficultyMulFx": 5000
    },
    "mechanics": {
      "hardnessEdgeFx": 1500,
      "toughnessFracFx": 4000,
      "rigidityFx": 3500
    },
    "electricMagic": {
      "manaConductivityFx": 8000,
      "electricCategory": "insulator"
    },
    "economy": {
      "valueMulFx": 3000,
      "beautyMulFx": 4000
    }
  },
  {
    "id": "core_mat_liquid_water",
    "aliases": [
      "water",
      "liquid_water"
    ],
    "tags": [
      "liquid",
      "water"
    ],
    "density_solid": 1000,
    "work": {
      "forgeable": false,
      "weldable": false,
      "carveable": false,
      "processDifficultyMulFx": 0
    },
    "navigation": {
      "move_cost_add": 30,
      "hazard_level": 3,
      "hazard_type": "drowning",
      "frictionMulFx": 3000
    },
    "mechanics": {
      "hardnessEdgeFx": 0,
      "toughnessFracFx": 0,
      "rigidityFx": 0
    },
    "electricMagic": {
      "manaConductivityFx": 9000,
      "electricCategory": "semi"
    },
    "economy": {
      "valueMulFx": 100,
      "beautyMulFx": 3000
    }
  },
  {
    "_comment": "=== STONES (ID 10-29) === (was numeric ID 10)",
    "id": "core_mat_stone_granite",
    "aliases": [
      "granite"
    ],
    "tags": [
      "stone",
      "igneous",
      "hard",
      "buildable"
    ],
    "density_solid": 2750,
    "work": {
      "forgeable": false,
      "weldable": false,
      "carveable": true,
      "processDifficultyMulFx": 14000
    },
    "mechanics": {
      "hardnessEdgeFx": 7500,
      "toughnessFracFx": 6500,
      "rigidityFx": 9000
    },
    "electricMagic": {
      "manaConductivityFx": 2500,
      "electricCategory": "insulator"
    },
    "economy": {
      "valueMulFx": 12000,
      "beautyMulFx": 10000
    }
  },
  {
    "id": "core_mat_stone_marble",
    "aliases": [
      "marble"
    ],
    "tags": [
      "stone",
      "metamorphic",
      "decorative",
      "flux"
    ],
    "density_solid": 2700,
    "work": {
      "forgeable": false,
      "weldable": false,
      "carveable": true,
      "processDifficultyMulFx": 12000
    },
    "mechanics": {
      "hardnessEdgeFx": 6000,
      "toughnessFracFx": 5000,
      "rigidityFx": 8000
    },
    "electricMagic": {
      "manaConductivityFx": 3000,
      "electricCategory": "insulator"
    },
    "economy": {
      "valueMulFx": 25000,
      "beautyMulFx": 18000
    }
  },
  {
    "id": "core_mat_stone_basalt",
    "aliases": [
      "basalt"
    ],
    "tags": [
      "stone",
      "volcanic",
      "dark"
    ],
    "density_solid": 3000,
    "work": {
      "forgeable": false,
      "weldable": false,
      "carveable": true,
      "processDifficultyMulFx": 15000
    },
    "mechanics": {
      "hardnessEdgeFx": 7800,
      "toughnessFracFx": 7000,
      "rigidityFx": 8500
    },
    "electricMagic": {
      "manaConductivityFx": 1500,
      "electricCategory": "insulator"
    },
    "economy": {
      "valueMulFx": 9000,
      "beautyMulFx": 8000
    }
  },
  {
    "id": "core_mat_stone_sandstone",
    "aliases": [
      "sandstone"
    ],
    "tags": [
      "stone",
      "sedimentary",
      "soft"
    ],
    "density_solid": 2200,
    "work": {
      "forgeable": false,
      "weldable": false,
      "carveable": true,
      "processDifficultyMulFx": 8000
    },
    "mechanics": {
      "hardnessEdgeFx": 4500,
      "toughnessFracFx": 3500,
      "rigidityFx": 6000
    },
    "electricMagic": {
      "manaConductivityFx": 4000,
      "electricCategory": "insulator"
    },
    "economy": {
      "valueMulFx": 7000,
      "beautyMulFx": 6000
    }
  },
  {
    "id": "core_mat_stone_limestone",
    "aliases": [
      "limestone"
    ],
    "tags": [
      "stone",
      "sedimentary",
      "flux"
    ],
    "density_solid": 2600,
    "work": {
      "forgeable": false,
      "weldable": false,
      "carveable": true,
      "processDifficultyMulFx": 9000
    },
    "mechanics": {
      "hardnessEdgeFx": 5000,
      "toughnessFracFx": 4000,
      "rigidityFx": 7000
    },
    "electricMagic": {
      "manaConductivityFx": 3500,
      "electricCategory": "insulator"
    },
    "economy": {
      "valueMulFx": 8000,
      "beautyMulFx": 7000
    }
  },
  {
    "id": "core_mat_stone_shale",
    "aliases": [
      "shale"
    ],
    "tags": [
      "stone",
      "sedimentary",
      "layered"
    ],
    "density_solid": 2400,
    "work": {
      "forgeable": false,
      "weldable": false,
      "carveable": true,
      "processDifficultyMulFx": 7000
    },
    "mechanics": {
      "hardnessEdgeFx": 4000,
      "toughnessFracFx": 2500,
      "rigidityFx": 5000
    },
    "electricMagic": {
      "manaConductivityFx": 4500,
      "electricCategory": "insulator"
    },
    "economy": {
      "valueMulFx": 6000,
      "beautyMulFx": 5000
    }
  },
  {
    "id": "core_mat_stone_slate",
    "aliases": [
      "slate"
    ],
    "tags": [
      "stone",
      "metamorphic",
      "layered"
    ],
    "density_solid": 2800,
    "work": {
      "forgeable": false,
      "weldable": false,
      "carveable": true,
      "processDifficultyMulFx": 11000
    },
    "mechanics": {
      "hardnessEdgeFx": 5500,
      "toughnessFracFx": 4500,
      "rigidityFx": 7500
    },
    "electricMagic": {
      "manaConductivityFx": 3000,
      "electricCategory": "insulator"
    },
    "economy": {
      "valueMulFx": 11000,
      "beautyMulFx": 9000
    }
  },
  {
    "id": "core_mat_stone_quartzite",
    "aliases": [
      "quartzite"
    ],
    "tags": [
      "stone",
      "metamorphic",
      "hard",
      "glass"
    ],
    "density_solid": 2650,
    "work": {
      "forgeable": false,
      "weldable": false,
      "carveable": true,
      "processDifficultyMulFx": 16000
    },
    "mechanics": {
      "hardnessEdgeFx": 8000,
      "toughnessFracFx": 6000,
      "rigidityFx": 8800
    },
    "electricMagic": {
      "manaConductivityFx": 2000,
      "electricCategory": "insulator"
    },
    "economy": {
      "valueMulFx": 13000,
      "beautyMulFx": 11000
    }
  },
  {
    "id": "core_mat_stone_gneiss",
    "aliases": [
      "gneiss"
    ],
    "tags": [
      "stone",
      "metamorphic",
      "banded"
    ],
    "density_solid": 2700,
    "work": {
      "forgeable": false,
      "weldable": false,
      "carveable": true,
      "processDifficultyMulFx": 13000
    },
    "mechanics": {
      "hardnessEdgeFx": 7000,
      "toughnessFracFx": 5800,
      "rigidityFx": 8200
    },
    "electricMagic": {
      "manaConductivityFx": 2800,
      "electricCategory": "insulator"
    },
    "economy": {
      "valueMulFx": 10000,
      "beautyMulFx": 10000
    }
  },
  {
    "id": "core_mat_stone_obsidian",
    "aliases": [
      "obsidian"
    ],
    "tags": [
      "stone",
      "volcanic",
      "glass",
      "sharp"
    ],
    "density_solid": 2350,
    "work": {
      "forgeable": false,
      "weldable": false,
      "carveable": true,
      "processDifficultyMulFx": 18000
    },
    "mechanics": {
      "hardnessEdgeFx": 8500,
      "toughnessFracFx": 2000,
      "rigidityFx": 9000
    },
    "electricMagic": {